<?xml version="1.0" encoding="UTF-8"?>
<!DOCTYPE mappings PUBLIC "-//DOZER//DTD MAPPINGS//EN"
  "http://dozer.sourceforge.net/dtd/dozerbeanmapping.dtd">

<mappings>

  <configuration>
     <stop-on-errors>false</stop-on-errors>
     <date-format>MM/dd/yyyy HH:mm</date-format> <!-- default date-format will apply to all class maps unless the class mapping explicitly overrides it -->
     <wildcard>false</wildcard> <!-- default wildcard policy that will apply to all class maps unless the class mapping explicitly overrides it -->
          
     <copy-by-references>
       <copy-by-reference>net.sf.dozer.util.mapping.vo.NoExtendBaseObjectGlobalCopyByReference</copy-by-reference>
     </copy-by-references>
          
  </configuration>

  <mapping stop-on-errors="true">
    <class-a>net.sf.dozer.util.mapping.vo.FurtherTestObject</class-a>
    <class-b>net.sf.dozer.util.mapping.vo.Car</class-b>    
  </mapping>

  <mapping wildcard="true">
    <class-a>net.sf.dozer.util.mapping.vo.SuperSuperSuperClass</class-a>
    <class-b>net.sf.dozer.util.mapping.vo.SuperSuperSuperClassPrime</class-b>    
  </mapping>

  <mapping>
    <class-a>net.sf.dozer.util.mapping.vo.TestObject</class-a>
    <class-b>net.sf.dozer.util.mapping.vo.TestObjectPrime</class-b>
    
    <field copy-by-reference="false">
      <a>globalCopyByReference</a>
      <b>globalCopyByReferencePrime</b>
    </field>    
  </mapping>
  
</mappings>