<?xml version="1.0" encoding="UTF-8"?>
<!DOCTYPE mappings PUBLIC "-//DOZER//DTD MAPPINGS//EN"
   "http://dozer.sourceforge.net/dtd/dozerbeanmapping.dtd">
<mappings>

  <mapping>
    <class-a>net.sf.dozer.util.mapping.vo.SimpleObj</class-a>
    <class-b>net.sf.dozer.util.mapping.vo.SimpleObjPrime2</class-b>    
    <field custom-converter="net.sf.dozer.util.mapping.converters.StringAppendCustomConverter">
      <a>field1</a>
      <b>field1Prime</b>
    </field>
  </mapping>   
  
  <mapping>
    <class-a>net.sf.dozer.util.mapping.vo.map.CustomMap</class-a>
    <class-b>net.sf.dozer.util.mapping.vo.SimpleObj</class-b>    
    <field custom-converter="net.sf.dozer.util.mapping.converters.StringAppendCustomConverter">
      <a map-get-method="getValue" key="fieldA">this</a>
      <b>field1</b>
    </field>
  </mapping>   

  <mapping>
    <class-a>net.sf.dozer.util.mapping.vo.map.MapToProperty</class-a>
    <class-b>net.sf.dozer.util.mapping.vo.SimpleObj</class-b>    
    <field custom-converter="net.sf.dozer.util.mapping.converters.StringAppendCustomConverter">
      <a key="fieldA">hashMap</a>
      <b>field1</b>
    </field>
  </mapping>   
  

</mappings>