<?xml version="1.0" encoding="UTF-8"?>
  <!DOCTYPE mappings PUBLIC "-//DOZER//DTD MAPPINGS//EN"
    "http://dozer.sourceforge.net/dtd/dozerbeanmapping.dtd">
<mappings>
  <configuration>
  <copy-by-references>
     <copy-by-reference>
       net.sf.dozer.util.mapping.copybyreference.Reference
     </copy-by-reference>
  </copy-by-references>
  </configuration>
  <mapping> 
    <class-a>net.sf.dozer.util.mapping.copybyreference.TestA</class-a>
    <class-b>net.sf.dozer.util.mapping.copybyreference.TestB</class-b>   
    <field>
      <a>oneA</a>
      <b>oneB</b>
    </field>
  </mapping>  


</mappings>