<?xml version="1.0" encoding="UTF-8"?>
<!DOCTYPE mappings PUBLIC "-//DOZER//DTD MAPPINGS//EN"
   "http://dozer.sourceforge.net/dtd/dozerbeanmapping.dtd">
<mappings>

  <mapping>
    <class-a>net.sf.dozer.util.mapping.vo.set.SomeDTO</class-a>
    <class-b>net.sf.dozer.util.mapping.vo.set.SomeVO</class-b>
    <field>
      <a>Field2</a>
      <b>Field2</b>
      <a-hint>net.sf.dozer.util.mapping.vo.set.SomeOtherDTO</a-hint>
      <b-hint>net.sf.dozer.util.mapping.vo.set.SomeOtherVO</b-hint>
    </field>
  </mapping>

</mappings>