<?xml version="1.0" encoding="UTF-8"?>
<!DOCTYPE mappings PUBLIC "-//DOZER//DTD MAPPINGS//EN"
   "http://dozer.sourceforge.net/dtd/dozerbeanmapping.dtd">
<mappings>

  <mapping map-null="false" map-empty-string="false">
    <class-a>net.sf.dozer.util.mapping.vo.AnotherTestObject</class-a>
    <class-b>net.sf.dozer.util.mapping.vo.AnotherTestObjectPrime</class-b>
    <field>
      <a>field4</a>
      <b>to.one</b>
    </field>
  </mapping>

  <mapping>
    <class-a>net.sf.dozer.util.mapping.vo.TestObject</class-a>
    <class-b map-null="false" map-empty-string="false">net.sf.dozer.util.mapping.vo.TestObjectPrime2</class-b>
  </mapping>

</mappings>