<?xml version="1.0" encoding="UTF-8"?>
<!DOCTYPE mappings PUBLIC "-//DOZER//DTD MAPPINGS//EN"
   "http://dozer.sourceforge.net/dtd/dozerbeanmapping.dtd">
<mappings>

  <mapping>
    <class-a>net.sf.dozer.util.mapping.vo.map.MapToMap</class-a>
    <class-b>net.sf.dozer.util.mapping.vo.map.MapToMapPrime</class-b>

    <field>
      <a is-accessible="true">standardMapWithHint</a>
      <b is-accessible="true">standardMapWithHint</b>
      <a-hint>net.sf.dozer.util.mapping.vo.TestObject</a-hint>
      <b-hint>net.sf.dozer.util.mapping.vo.TestObjectPrime</b-hint>
    </field>

  </mapping>

</mappings>
